Title,Content,Category,Featured Image URL
Best outdoor adventure activities,,Adventure and Outdoor Activities,https://example.com/featured-image.jpg
Top adventure travel destinations,,Adventure and Outdoor Activities,https://example.com/featured-image.jpg
Beginner hiking trails near me,,Adventure and Outdoor Activities,https://example.com/featured-image.jpg
Family-friendly outdoor activities,,Adventure and Outdoor Activities,https://example.com/featured-image.jpg
Extreme sports for thrill-seekers,,Adventure and Outdoor Activities,https://example.com/featured-image.jpg
National parks camping guide,,Adventure and Outdoor Activities,https://example.com/featured-image.jpg
Essential hiking gear for beginners,,Adventure and Outdoor Activities,https://example.com/featured-image.jpg
Adventure tours for solo travelers,,Adventure and Outdoor Activities,https://example.com/featured-image.jpg
Top mountain biking trails worldwide,,Adventure and Outdoor Activities,https://example.com/featured-image.jpg
Best places for kayaking adventures,,Adventure and Outdoor Activities,https://example.com/featured-image.jpg
How to plan a backpacking trip,,Adventure and Outdoor Activities,https://example.com/featured-image.jpg
Wildlife photography tips for beginners,,Adventure and Outdoor Activities,https://example.com/featured-image.jpg
Scuba diving hotspots,,Adventure and Outdoor Activities,https://example.com/featured-image.jpg
Best rock climbing locations,,Adventure and Outdoor Activities,https://example.com/featured-image.jpg
Wilderness survival skills guide,,Adventure and Outdoor Activities,https://example.com/featured-image.jpg
Budget-friendly adventure trips,,Adventure and Outdoor Activities,https://example.com/featured-image.jpg
Scenic coastal hikes near me,,Adventure and Outdoor Activities,https://example.com/featured-image.jpg
Top winter outdoor activities,,Adventure and Outdoor Activities,https://example.com/featured-image.jpg
Planning a cross-country road trip,,Adventure and Outdoor Activities,https://example.com/featured-image.jpg
Best destinations for eco-friendly travel,,Adventure and Outdoor Activities,https://example.com/featured-image.jpg
Thrilling white-water rafting locations,,Adventure and Outdoor Activities,https://example.com/featured-image.jpg
Glamping spots for luxury camping,,Adventure and Outdoor Activities,https://example.com/featured-image.jpg
Top national parks to visit,,Adventure and Outdoor Activities,https://example.com/featured-image.jpg
How to pack for a camping trip,,Adventure and Outdoor Activities,https://example.com/featured-image.jpg
Best destinations for paragliding,,Adventure and Outdoor Activities,https://example.com/featured-image.jpg
Family camping tips and tricks,,Adventure and Outdoor Activities,https://example.com/featured-image.jpg
Best islands for adventure travel,,Adventure and Outdoor Activities,https://example.com/featured-image.jpg
Top spots for snowboarding and skiing,,Adventure and Outdoor Activities,https://example.com/featured-image.jpg
Caving and spelunking destinations,,Adventure and Outdoor Activities,https://example.com/featured-image.jpg
Cross-country skiing routes,,Adventure and Outdoor Activities,https://example.com/featured-image.jpg
How to choose the best camping gear,,Adventure and Outdoor Activities,https://example.com/featured-image.jpg
Best adventure activities for couples,,Adventure and Outdoor Activities,https://example.com/featured-image.jpg
Exploring the Amazon rainforest,,Adventure and Outdoor Activities,https://example.com/featured-image.jpg
Best places to go on a wildlife safari,,Adventure and Outdoor Activities,https://example.com/featured-image.jpg
Top river rafting destinations worldwide,,Adventure and Outdoor Activities,https://example.com/featured-image.jpg
Adventure travel for seniors,,Adventure and Outdoor Activities,https://example.com/featured-image.jpg
Best places for snorkeling adventures,,Adventure and Outdoor Activities,https://example.com/featured-image.jpg
How to prepare for a high-altitude trek,,Adventure and Outdoor Activities,https://example.com/featured-image.jpg
Best off-road adventures for ATVs,,Adventure and Outdoor Activities,https://example.com/featured-image.jpg
Top spots for bungee jumping,,Adventure and Outdoor Activities,https://example.com/featured-image.jpg
Essential gear for mountain climbing,,Adventure and Outdoor Activities,https://example.com/featured-image.jpg
Best destinations for skydiving,,Adventure and Outdoor Activities,https://example.com/featured-image.jpg
Tips for planning a solo adventure trip,,Adventure and Outdoor Activities,https://example.com/featured-image.jpg
Best places to go horseback riding,,Adventure and Outdoor Activities,https://example.com/featured-image.jpg
How to survive in the wilderness,,Adventure and Outdoor Activities,https://example.com/featured-image.jpg
Planning an epic road trip across the USA,,Adventure and Outdoor Activities,https://example.com/featured-image.jpg
Best places for hot air balloon rides,,Adventure and Outdoor Activities,https://example.com/featured-image.jpg
Winter camping tips and techniques,,Adventure and Outdoor Activities,https://example.com/featured-image.jpg
Top destinations for whale watching,,Adventure and Outdoor Activities,https://example.com/featured-image.jpg
Best places to go kitesurfing,,Adventure and Outdoor Activities,https://example.com/featured-image.jpg
